<?xml version="1.0" encoding="UTF-8"?>
<editor xmlns="http://lang.whole.org/Editors" xmlns:xsi="http://www.w3.org/2001/XMLSchema-instance" xsi:schemaLocation="http://lang.whole.org/Editors Editors.xsd">
    <identifier>FirstOrderLogicTextual</identifier>
    <modelComponent>
        <identifier>FirstOrderLogic</identifier>
    </modelComponent>
    <viewComponent>
        <declarations>
            <simpleFigureDeclaration>
                <identifier>TheoryFigure</identifier>
                <foldableTextualFigure>
                    <expandedFigure>
                        <row>
                            <keywordToken>theory</keywordToken>
                            <childPlace/>
                            <foldingToggle/>
                        </row>
                        <row>
                            <indent/>
                            <childPlace/>
                        </row>
                        <row>
                            <indent/>
                            <keywordToken>declarations</keywordToken>
                        </row>
                        <row>
                            <indent/>
                            <indent/>
                            <childPlace/>
                        </row>
                        <row>
                            <indent/>
                            <keywordToken>assertions</keywordToken>
                        </row>
                        <row>
                            <indent/>
                            <indent/>
                            <childPlace/>
                        </row>
                    </expandedFigure>
                    <collapsedFigure>
                        <row>
                            <keywordToken>theory</keywordToken>
                            <childPlace/>
                            <foldingToggle/>
                        </row>
                    </collapsedFigure>
                </foldableTextualFigure>
            </simpleFigureDeclaration>
            <simpleFigureDeclaration>
                <identifier>ImportDeclarationFigure</identifier>
                <textualFigure>
                    <row>
                        <keywordToken>import</keywordToken>
                        <childPlace/>
                        <keywordToken>as</keywordToken>
                        <childPlace/>
                    </row>
                </textualFigure>
            </simpleFigureDeclaration>
            <simpleFigureDeclaration>
                <identifier>EqualityPredicateApplicationFigure</identifier>
                <textualFigure>
                    <row>
                        <childPlace/>
                        <operatorToken>=</operatorToken>
                        <childPlace/>
                    </row>
                </textualFigure>
            </simpleFigureDeclaration>
            <simpleFigureDeclaration>
                <identifier>SubtypeDeclarationFigure</identifier>
                <textualFigure>
                    <row>
                        <childPlace/>
                        <operatorToken>&lt;=</operatorToken>
                        <childPlace/>
                    </row>
                </textualFigure>
            </simpleFigureDeclaration>
            <simpleFigureDeclaration>
                <identifier>NameDeclarationFigure</identifier>
                <textualFigure>
                    <row>
                        <childPlace/>
                        <operatorToken>:</operatorToken>
                        <childPlace/>
                        <indent/>
                        <parenthesisToken>{</parenthesisToken>
                        <childPlace/>
                        <parenthesisToken>}</parenthesisToken>
                    </row>
                </textualFigure>
            </simpleFigureDeclaration>
            <simpleFigureDeclaration>
                <identifier>SortTypeFigure</identifier>
                <textualFigure>
                    <row>
                        <keywordToken>sort</keywordToken>
                    </row>
                </textualFigure>
            </simpleFigureDeclaration>
            <simpleFigureDeclaration>
                <identifier>VariableTypeFigure</identifier>
                <textualFigure>
                    <row>
                        <childPlace/>
                    </row>
                </textualFigure>
            </simpleFigureDeclaration>
            <simpleFigureDeclaration>
                <identifier>FunctionTypeFigure</identifier>
                <textualFigure>
                    <row>
                        <parenthesisToken>(</parenthesisToken>
                        <childPlace/>
                        <parenthesisToken>)</parenthesisToken>
                        <operatorToken>-&gt;</operatorToken>
                        <childPlace/>
                    </row>
                </textualFigure>
            </simpleFigureDeclaration>
            <simpleFigureDeclaration>
                <identifier>PredicateTypeFigure</identifier>
                <textualFigure>
                    <row>
                        <parenthesisToken>(</parenthesisToken>
                        <childPlace/>
                        <parenthesisToken>)</parenthesisToken>
                    </row>
                </textualFigure>
            </simpleFigureDeclaration>
            <simpleFigureDeclaration>
                <identifier>VariableDeclarationFigure</identifier>
                <textualFigure>
                    <row>
                        <childPlace/>
                        <operatorToken>:</operatorToken>
                        <childPlace/>
                    </row>
                </textualFigure>
            </simpleFigureDeclaration>
            <simpleFigureDeclaration>
                <identifier>ExistUniqueFigure</identifier>
                <textualFigure>
                    <row>
                        <keywordToken>?!</keywordToken>
                        <parenthesisToken>(</parenthesisToken>
                        <childPlace/>
                        <parenthesisToken>)</parenthesisToken>
                        <childPlace/>
                    </row>
                </textualFigure>
            </simpleFigureDeclaration>
            <simpleFigureDeclaration>
                <identifier>QualifiedNameFigure</identifier>
                <textualFigure>
                    <row>
                        <childPlace/>
                        <operatorToken>.</operatorToken>
                        <childPlace/>
                    </row>
                </textualFigure>
            </simpleFigureDeclaration>
            <simpleFigureDeclaration>
                <identifier>FeatureNameFigure</identifier>
                <textualFigure>
                    <row>
                        <childPlace/>
                        <operatorToken>.</operatorToken>
                        <childPlace/>
                        <operatorToken>.</operatorToken>
                        <childPlace/>
                    </row>
                </textualFigure>
            </simpleFigureDeclaration>
            <simpleFigureDeclaration>
                <identifier>PredicateFigure</identifier>
                <textualFigure>
                    <row>
                        <keywordToken>predicate</keywordToken>
                        <childPlace/>
                        <parenthesisToken>(</parenthesisToken>
                        <childPlace/>
                        <parenthesisToken>)</parenthesisToken>
                        <delimiterToken>:</delimiterToken>
                        <childPlace/>
                    </row>
                </textualFigure>
            </simpleFigureDeclaration>
            <simpleFigureDeclaration>
                <identifier>FunctionFigure</identifier>
                <textualFigure>
                    <row>
                        <keywordToken>function</keywordToken>
                        <childPlace/>
                        <parenthesisToken>(</parenthesisToken>
                        <childPlace/>
                        <parenthesisToken>)</parenthesisToken>
                        <delimiterToken>:</delimiterToken>
                        <childPlace/>
                    </row>
                </textualFigure>
            </simpleFigureDeclaration>
            <simpleFigureDeclaration>
                <identifier>AxiomFigure</identifier>
                <textualFigure>
                    <row>
                        <keywordToken>axiom</keywordToken>
                        <childPlace/>
                        <delimiterToken>:</delimiterToken>
                        <childPlace/>
                    </row>
                </textualFigure>
            </simpleFigureDeclaration>
            <simpleFigureDeclaration>
                <identifier>TheoremFigure</identifier>
                <textualFigure>
                    <row>
                        <keywordToken>theorem</keywordToken>
                        <childPlace/>
                        <delimiterToken>:</delimiterToken>
                        <childPlace/>
                    </row>
                    <row>
                        <indent/>
                        <childPlace/>
                    </row>
                </textualFigure>
            </simpleFigureDeclaration>
            <simpleFigureDeclaration>
                <identifier>ApplicationFigure</identifier>
                <textualFigure>
                    <row>
                        <childPlace/>
                        <parenthesisToken>(</parenthesisToken>
                        <childPlace/>
                        <parenthesisToken>)</parenthesisToken>
                    </row>
                </textualFigure>
            </simpleFigureDeclaration>
        </declarations>
    </viewComponent>
    <controllerComponent>
        <declarations>
            <partDeclaration>